{
  "$schema": "https://json-schema.org/draft/2020-12/schema",
  "$id": "contracts/browser-transfer/v1/browser-worker-readiness.schema.json",
  "title": "browser-worker-readiness",
  "description": "Read-only, sanitized OMES host evidence for an OPTIONAL browser worker. Does not assert a Playwright worker exists; does not disclose session state, tokens or raw model prompts. User-facing health must not infer readiness when missing or stale.",
  "type": "object",
  "required": [
    "schema_version",
    "tenant_id",
    "server_id",
    "worker_id",
    "state",
    "browser_engine",
    "adapter_version",
    "browser_version",
    "model_provider",
    "model_ready",
    "session_isolation",
    "exposure",
    "observed_at",
    "reason_codes"
  ],
  "additionalProperties": false,
  "properties": {
    "schema_version": {
      "type": "string",
      "const": "1.0.0"
    },
    "tenant_id": {
      "type": "string",
      "pattern": "^[A-Za-z0-9_.:-]{1,128}$"
    },
    "server_id": {
      "type": "string",
      "pattern": "^[A-Za-z0-9_.:-]{1,128}$"
    },
    "worker_id": {
      "type": "string",
      "pattern": "^[A-Za-z0-9_.:-]{1,128}$"
    },
    "state": {
      "type": "string",
      "enum": [
        "ready",
        "degraded",
        "blocked",
        "unsupported",
        "unknown"
      ]
    },
    "browser_engine": {
      "type": "string",
      "enum": [
        "chromium",
        "firefox",
        "webkit",
        "not_installed",
        "unknown"
      ]
    },
    "adapter_version": {
      "type": "string",
      "pattern": "^[A-Za-z0-9_.:+-]{1,64}$"
    },
    "browser_version": {
      "type": "string",
      "pattern": "^[A-Za-z0-9_.:+-]{1,64}$"
    },
    "model_provider": {
      "type": "string",
      "enum": [
        "ollama",
        "none",
        "unknown"
      ]
    },
    "model_id": {
      "type": "string",
      "pattern": "^[A-Za-z0-9_./:@+-]{1,128}$"
    },
    "model_ready": {
      "type": "string",
      "enum": [
        "ready",
        "not_required",
        "unavailable",
        "unknown"
      ]
    },
    "session_isolation": {
      "type": "string",
      "enum": [
        "per_job",
        "not_configured",
        "unknown"
      ]
    },
    "exposure": {
      "type": "string",
      "enum": [
        "loopback",
        "private_boundary",
        "public_blocked",
        "unknown"
      ]
    },
    "observed_at": {
      "type": "string",
      "pattern": "^\\d{4}-\\d{2}-\\d{2}T\\d{2}:\\d{2}:\\d{2}Z$"
    },
    "reason_codes": {
      "type": "array",
      "minItems": 1,
      "maxItems": 20,
      "items": {
        "type": "string",
        "pattern": "^[A-Z][A-Z0-9_]{0,63}$"
      }
    },
    "capability_profile": {
      "type": "string",
      "enum": [
        "deterministic",
        "ai_assisted",
        "unknown"
      ]
    },
    "hermes_version": {
      "type": "string",
      "pattern": "^[A-Za-z0-9_.:+-]{1,64}$"
    }
  }
}
