{
  "schema_version": "1.0.0",
  "tenant_id": "tenant-fixture",
  "server_id": "server-fixture",
  "worker_id": "worker-fixture",
  "state": "ready",
  "browser_engine": "chromium",
  "adapter_version": "adapter-v1",
  "browser_version": "chromium-123",
  "model_provider": "ollama",
  "model_id": "qwen3.5:9b",
  "model_ready": "ready",
  "session_isolation": "per_job",
  "exposure": "loopback",
  "capability_profile": "ai_assisted",
  "observed_at": "2026-10-12T02:00:00Z",
  "reason_codes": [
    "HEALTHY_SYNTHETIC_CHECK"
  ]
}
